{
    "$schema": "http://json-schema.org/draft-07/schema#",
    "$id": "https://github.com/oicr-gsi/djerba/blob/master/src/lib/djerba/data/input_schema.json",
    "type": "object",
    "properties":
    {
	"study_meta": {
	    "type": "object",
	    "properties": {
		"add_global_case_list": {"type": "boolean"},
		"cancer_study_identifier": {"type": "string"},
		"citation": {"type": ["string", "null"]},
		"description": {"type": "string"},
		"groups": {"type": ["string", "null"]},
		"name": {"type": "string"},
		"pmid": {"type": ["string", "null"]},
		"reference_genome": {"type": ["string", "null"]},
		"short_name": {"type": "string"},
		"tags_file": {"type": ["string", "null"]},
		"type_of_cancer": {"type": "string"}
	    },
	    "required": [
		"add_global_case_list",
		"cancer_study_identifier",
		"citation",
		"description",
		"groups",
		"name",
		"pmid",
		"reference_genome",
		"short_name",
		"tags_file",
		"type_of_cancer"
	    ]
	},
	"cancer_type": {
	    "type": "object",
	    "properties": {
		"clinical_trial_keywords": {
		    "type": "array",
		    "items": {"type": "string"}
		},
		"data_filename": {"type": "string"},
		"dedicated_color": {"type": ["string", "null"]},
		"name": {
		    "type": "array",
		    "items": {"type": "string"}
		},
		"parent_type_of_cancer": {
		    "type": "array",
		    "items": {"type": "string"}
		},
		"type_of_cancer": {"type": ["string", "null"]}
	    },
	    "required": [
		"clinical_trial_keywords",
		"data_filename",
		"dedicated_color",
		"name",
		"parent_type_of_cancer",
		"type_of_cancer"
	    ]
	},
	"case_lists": {
	    "type": "array",
	    "items": {
		"type": "object",
		"properties": {
		    "case_list_category": {"type": ["string", "null"]},
		    "case_list_description": {"type": "string"},
		    "case_list_ids": {
			"type": "array",
			"items": {"type": "string"}
		    },
		    "case_list_name": {"type": "string"},
		    "suffix": {"type": "string"}
		},
		"required": [
		    "case_list_category",
		    "case_list_description",
		    "case_list_ids",
		    "case_list_name"
		]
	    }
	},
	"samples_meta": {
	    "type": "object",
	    "properties": {
		"attribute_names":  {
		    "type": "array",
		    "items": {"type": "string"}
		},
		"datatypes":  {
		    "type": "array",
		    "items": {"type": "string"}
		},
		"descriptions":  {
		    "type": "array",
		    "items": {"type": "string"}
		},
		"display_names":  {
		    "type": "array",
		    "items": {"type": "string"}
		},
		"precision": {"type": "integer"},
		"priorities":  {
		    "type": "array",
		    "items": {"type": "integer"}
		},
		"write_patients":  {"type": "boolean"}
	    },
	    "required": [
		"attribute_names",
		"datatypes",
		"descriptions",
		"display_names",
		"precision",
		"priorities",
		"write_patients"
	    ]
	},
	"samples": {
	    "type": "array",
	    "items": {
		"type": "object",
		"properties": {
		    "SAMPLE_ID": {"type": "string"},
		    "COSMIC_SIGS": {"type": ["string", "null"]},
		    "CANCER_TYPE": {"type": ["string", "null"]},
		    "CANCER_TYPE_DETAILED": {"type": ["string", "null"]},
		    "CLOSEST_TCGA": {"type": ["string", "null"]},
		    "SAMPLE_ANATOMICAL_SITE": {"type": ["string", "null"]},
		    "SAMPLE_PRIMARY_OR_METASTASIS": {"type": ["string", "null"]},
		    "TREATMENT_STATUS": {"type": ["string", "null"]},
		    "PATHOLOGICAL_REVIEW": {"type": ["string", "null"]},
		    "MEAN_COVERAGE": {"type": ["integer", "null"]},
		    "PCT_v7_ABOVE_80x": {"type": ["number", "null"]},
		    "FRAC_CALLABILITY": {"type": ["number", "null"]},
		    "SEQUENZA_PURITY_FRACTION": {"type": ["integer", "null"]},
		    "SEQUENZA_PLOIDY": {"type": ["integer", "null"]},
		    "TMB_PER_MB": {"type": ["number", "null"]},
		    "HRD_SCORE": {"type": ["string", "null"]},
		    "MSI_STATUS": {"type": ["string", "null"]},
		    "SEX": {"type": ["string", "null"]},
		    "AGE": {"type": ["integer", "null"]},
		    "PATIENT_ID": {"type": ["string", "null"]},
		    "CENTRE": {"type": ["string", "null"]},
		    "FRACTION_GENOME_ALTERED": {"type": ["number", "null"]},
		    "TMB_PLOT": {"type": ["string", "null"]},
		    "VAF_PLOT": {"type": ["string", "null"]},
		    "ETHNICITY": {"type": ["string", "null"]}
		},
		"required": ["SAMPLE_ID"],
		"uniqueItems": true
	    }
	},
	"genetic_alterations": {
	    "type": "array",
	    "items": {
		"type": "object",
		"properties": {
		    "datatype": {
			"type": "string"
		    },
		    "genetic_alteration_type": {
			"type": "string"
		    },
		    "input_directory": {
			"type": "string"
		    },
		    "workflow_run_id": {
			"type": "string"
		    },
		    "input_files": {
			"type": "object"
		    },
		    "metadata": {
			"type": "object"
		    }
		},
		"required": [
		    "datatype", "genetic_alteration_type", "input_directory", "input_files", "metadata"
		],
		"uniqueItems": true
	    }
	}
    },
    "required": [
	"samples",
	"genetic_alterations"
    ],
    "dependencies": {
	"study_meta": ["cancer_type", "case_lists", "samples_meta"],
	"cancer_type": ["study_meta", "case_lists", "samples_meta"],
	"case_lists": ["study_meta", "cancer_type", "samples_meta"],
	"samples_meta": ["study_meta", "cancer_type", "case_lists"]
    }
}
