{
    "cancer_type": {
        "clinical_trial_keywords": [
            "carcinoma,ductal carcinoma"
        ],
        "data_filename": "cancer_type.txt",
        "dedicated_color": null,
        "name": [
            "Ductal Carcinoma"
        ],
        "parent_type_of_cancer": [
            "tissue"
        ],
        "type_of_cancer": null
    },
    "case_lists": [
        {
            "case_list_category": null,
            "case_list_description": "custom case list demonstration",
            "case_list_ids": [
                "OCT-01-0472-CAP"
            ],
            "case_list_name": "djerba_custom_case_list",
            "suffix": "custom"
        }
    ],
    "genetic_alterations": [
        {
            "datatype": "CUSTOM",
            "genetic_alteration_type": "CUSTOM_ANNOTATION",
            "input_files": {},
	    "input_directory": "/dummy/directory/replaced/in/test",
            "metadata": {
		"gene_headers": ["Gene", "Gene_metric_1", "Gene_metric_2", "Gene_metric_3"],
		"gene_tsv": "custom_gene_annotation.tsv",
		"sample_headers": ["SAMPLE_ID", "SAMPLE_METRIC_1", "SAMPLE_METRIC_2", "SAMPLE_METRIC_3"],
		"sample_tsv": "custom_sample_annotation.tsv"
            },
            "workflow_run_id": "jabberwocky_workflow_run_0001"
        }
    ],
    "samples": [
        {
            "AGE": 35,
            "CANCER_TYPE": "Bowel",
            "CANCER_TYPE_DETAILED": "MACR",
            "CENTRE": "TGL",
            "CLOSEST_TCGA": "coadread",
            "COSMIC_SIGS": null,
            "ETHNICITY": "Other",
            "FGA": null,
            "FRAC_CALLABILITY": null,
            "MEAN_COVERAGE": null,
            "PATHOLOGICAL_REVIEW": "Lots of immune cells",
            "PATIENT_ID": "OCT-01-0472",
            "PCT_v7_ABOVE_80x": null,
            "SAMPLE_ANATOMICAL_SITE": "OMENTUM",
            "SAMPLE_ID": "OCT-01-0472-CAP",
            "SAMPLE_PRIMARY_OR_METASTASIS": "Metastatic Lesion",
            "SEQUENZA_PLOIDY": null,
            "SEQUENZA_PURITY_FRACTION": null,
            "SEX": "Male",
	    "TMB_PER_MB":  null,
            "TREATMENT_STATUS": "Naive"
        }
    ],
    "samples_meta": {
        "attribute_names": [
            "PATIENT_ID",
            "SAMPLE_ID"
        ],
        "datatypes": [
            "STRING",
            "STRING"
        ],
        "descriptions": [
            "Patient identifier",
            "Sample identifier"
        ],
        "display_names": [
            "Patient identifier",
            "Sample identifier"
        ],
        "precision": 3,
        "priorities": [
            1,
            1
        ],
        "write_patients": true
    },
    "study_meta": {
        "add_global_case_list": true,
        "cancer_study_identifier": "djerba_test_001",
        "citation": null,
        "description": "Test of Djerba software package (September 2020)",
        "groups": null,
        "name": "Djerba Test 001",
        "pmid": null,
        "reference_genome": null,
        "short_name": "Djerba 001",
        "tags_file": null,
        "type_of_cancer": "ductal carcinoma"
    }
}
